{
  "schema_version": 1,
  "book": "mecanica-fluidos",
  "title": "Mecánica de Fluidos",
  "edition_number": 1,
  "edition_name": "Primera edición",
  "framework_version": "0.2.0",
  "academic_tool_version": "0.2.0",
  "generated_at": "2026-10-06T23:10:07.616009+00:00",
  "tree_sha256": "9730555e88d9838fe9ea51acef3741599d31c3c46cfe5a408e4d29139ff051db",
  "files": [
    {
      "path": "repo/AGENTS.md",
      "sha256": "ea05c54812b9df1ff0da9c258929d921c2fe3f7b88f4128342dc8acc3987891e",
      "bytes": 4256
    },
    {
      "path": "book/CHANGELOG.md",
      "sha256": "22b68421f6a965d5f94bc628718af21853492cce2271633eb63a2ac14e5c3a43",
      "bytes": 534
    },
    {
      "path": "book/README.md",
      "sha256": "64fb1c13b5dc2347075175a315e3cc51b8d398a14241d0e1ab7ff4e4b6121f65",
      "bytes": 1442
    },
    {
      "path": "book/ai/BRIEF.md",
      "sha256": "00e7aa503b257caa5dceb0835ee43d00effaf95ec051a6fee36cc0691a8ece04",
      "bytes": 12309
    },
    {
      "path": "book/appendices/formulario.tex",
      "sha256": "0c319b4413249f86e74a65da083cbccdd2e212953962c756928fed9f5c66bead",
      "bytes": 1509
    },
    {
      "path": "book/appendices/notation.tex",
      "sha256": "986b272efe277d1e199ebe46015f848b7e80122d619439c60d7a997d99c65a1e",
      "bytes": 1452
    },
    {
      "path": "book/appendices/source-audit.tex",
      "sha256": "964b3a941b412e808acbb9fbf403b33df9ba91d0cd1fff83a5830ac5d1abbc21",
      "bytes": 2767
    },
    {
      "path": "book/book.toml",
      "sha256": "b58a9d6804d7ddf73e63527c77509450f494960c9016fe4c9cdf0624a350f75a",
      "bytes": 1192
    },
    {
      "path": "book/chapters/00-preface.tex",
      "sha256": "504411cbeda6be7c0a92390a3a407f7e687da151c024dce45ac8faa99ef93f0a",
      "bytes": 1431
    },
    {
      "path": "book/chapters/01-continuo.tex",
      "sha256": "1d9a61f832a87a1eb0b4aadbc9ff1975203efc54b9acbe435588d8f03307b273",
      "bytes": 9622
    },
    {
      "path": "book/chapters/02-clasica.tex",
      "sha256": "131ac02691732711fd0f61d7c1b75d167f3bb765d16df3fced1b0ee19b807e85",
      "bytes": 11086
    },
    {
      "path": "book/chapters/03-vectorial.tex",
      "sha256": "236889091c1acbd8a788920b113403a3fc9e94fe9bd9df94468142e59ab3f51c",
      "bytes": 6026
    },
    {
      "path": "book/chapters/04-cinematica.tex",
      "sha256": "1988358077058a42bf713185170d2e44e582ec29e6805e79878e8601e4f36e95",
      "bytes": 8167
    },
    {
      "path": "book/chapters/05-hidrostatica.tex",
      "sha256": "a1ba19fcc3ee0d93fbc9c6adff4cfac710ee3bb4de9ad6a9a74f418ea0400b1e",
      "bytes": 6743
    },
    {
      "path": "book/chapters/06-conservacion.tex",
      "sha256": "3126271c7762556fdff3708c3c6b2cbc481e2b3581e6bac9f7c3df8c8ccd3aae",
      "bytes": 6192
    },
    {
      "path": "book/chapters/07-esfuerzos.tex",
      "sha256": "64ec668f756d1283e6380e3443b3b3bb875498fe476671bf11c8c3ad4e68852b",
      "bytes": 4920
    },
    {
      "path": "book/chapters/08-navier-stokes.tex",
      "sha256": "b2358453cdb6c2268babba0be412ba4be0b7e294b535b960582f9e7ffce676a6",
      "bytes": 8411
    },
    {
      "path": "book/chapters/09-bernoulli.tex",
      "sha256": "32f0ee35828639350f8cada436f0b6b4f0e0f6c7663ebda3628791b45039e967",
      "bytes": 4751
    },
    {
      "path": "book/chapters/10-semejanza.tex",
      "sha256": "b11613e2f6aaeefbd2fa41bfc85ae05eeda5235214ffa746c094912912cae55f",
      "bytes": 6326
    },
    {
      "path": "book/chapters/11-aplicaciones.tex",
      "sha256": "661713ec2779931262257010b2719cb87732c109fa991068cc9c4db4933000e2",
      "bytes": 5356
    },
    {
      "path": "book/chapters/12-aproximaciones.tex",
      "sha256": "7f9faf3b925de3f99715f04049de1a0168e0813f9c2a2bccceabe42e83f85818",
      "bytes": 6207
    },
    {
      "path": "book/chapters/13-examen.tex",
      "sha256": "b2538e880261708ebc6b1eb2ac46c5a47e4b0b773e546a2e3fa6b14780c35e6c",
      "bytes": 5104
    },
    {
      "path": "book/claims/ledger.jsonl",
      "sha256": "3bac3ffd885a1341e26d6ec423835854a7fc816cdca91f7bc203344bd8e0ed1a",
      "bytes": 11551
    },
    {
      "path": "book/evidence/README.md",
      "sha256": "978de37a50939e1e601b7ae7229cd07753b12afbf3598e89a3a6cb53f6144b35",
      "bytes": 203
    },
    {
      "path": "book/evidence/map.jsonl",
      "sha256": "e4ee578e530cc9e216e7dac9cfb36a3c958f4d0808fd70423b62709b63218339",
      "bytes": 8829
    },
    {
      "path": "book/figures/README.md",
      "sha256": "315037594367c3684b3f1869ef3c0a02aa1ee2bfa5aa4f5240503d4b7a0bd00d",
      "bytes": 295
    },
    {
      "path": "book/figures/cover-graphic.tex",
      "sha256": "c5917c7b56be1d11a401a8d016942831946621efaea6aa5574e4f299ce07a3a8",
      "bytes": 515
    },
    {
      "path": "book/main.tex",
      "sha256": "c0d34ce34c0c05b4f9de3036539e1eafc101e9e7cbb971b297303ec14a4acfd2",
      "bytes": 1245
    },
    {
      "path": "book/references.bib",
      "sha256": "e677e480f05d3431c4656455e74d3ffc17ed05f6ae949d33eb22acc180add066",
      "bytes": 5425
    },
    {
      "path": "book/reviews/README.md",
      "sha256": "aa3a9d4a7578ccc4ab2d62e693ba7475e4dc509152106e3409a9e42360ee4279",
      "bytes": 632
    },
    {
      "path": "book/reviews/REV-CITATION-001.json",
      "sha256": "79b97ca64d0c9572ccc909719cd2984f6fbde8b5ae41644928b59d1003073ba3",
      "bytes": 872
    },
    {
      "path": "book/reviews/REV-COPYRIGHT-001.json",
      "sha256": "724290884bafc81c999ba851afffd13397ea421ba5ce6deff2774ac61d8358ad",
      "bytes": 726
    },
    {
      "path": "book/reviews/REV-DERIVATION-001.json",
      "sha256": "eba19e57dea67f19da6ba0efe2feb9cb3ceef9867142ba18d2109598dbbac2c0",
      "bytes": 878
    },
    {
      "path": "book/reviews/REV-EXERCISE_REVIEW-001.json",
      "sha256": "fd4c9382f4162d67c30b80ee545b42ffa712e6f8d1428acc80f1d7fab3892898",
      "bytes": 941
    },
    {
      "path": "book/reviews/REV-FIGURE-001.json",
      "sha256": "836a56ad24744e006ae05737eeb6cc6d7b837980a2c566edab56c57a51db41c8",
      "bytes": 866
    },
    {
      "path": "book/reviews/REV-LATEX-001.json",
      "sha256": "8f6fe39b7a5cc787c47a29bb08e56a0fe45652f67f57880d127427c5435047f4",
      "bytes": 874
    },
    {
      "path": "book/reviews/REV-MATHEMATICAL-001.json",
      "sha256": "9e0c3f47935627e40891b8ef7ba2daa3afed61e5054861515161db9dcafbabf3",
      "bytes": 928
    },
    {
      "path": "book/reviews/REV-PEDAGOGY-001.json",
      "sha256": "7c3d5106951e239df6997bb76495b281885f6a880a5ef95b286cb92e16865647",
      "bytes": 843
    },
    {
      "path": "book/reviews/REV-RED_TEAM-001.json",
      "sha256": "aab4912b193a2bb8ca7f9e028bba207ed0228bcdf58edc39d5b589dbd7bfea4d",
      "bytes": 1014
    },
    {
      "path": "book/reviews/REV-RELEASE-001.json",
      "sha256": "00f5529fa778916566610a31514158f95f410747ceb028b1fbf7962647080720",
      "bytes": 848
    },
    {
      "path": "book/reviews/REV-SCIENTIFIC-001.json",
      "sha256": "9a31abd7a864cb7ddc0c115e89f5e05a8c9276c1ddc3e1e879f9597530397f09",
      "bytes": 1376
    },
    {
      "path": "book/reviews/REV-SOURCE-001.json",
      "sha256": "7c41439f54f36d7571a19c890e55064175d144ed88a2159874febf95dd632181",
      "bytes": 1009
    },
    {
      "path": "book/reviews/REV-UNITS-001.json",
      "sha256": "777a0eb5ef026d234d66614806a826022a73641193af06565cdcb0734c320e1f",
      "bytes": 838
    },
    {
      "path": "book/reviews/REVIEWING.md",
      "sha256": "9a82f98f082df2bcdd6314550b7f39c4e5150236c7514847814d76149eaefd10",
      "bytes": 299
    },
    {
      "path": "book/sources/conflicts.jsonl",
      "sha256": "6cce1bbb41fd945291436490d137ae0c8b4dd9b3edd4da981ad6e83080ec59b1",
      "bytes": 6294
    },
    {
      "path": "book/sources/manifest.json",
      "sha256": "843af5e14933886c161a83455569bbb444b3138b882dc7f9c0390e6c9d31b7d1",
      "bytes": 18687
    },
    {
      "path": "book/sources/ule-guia-2026-2027.snapshot.json",
      "sha256": "8a08da5c619b55ce5616daeefb6613acc243677f05898f030929746d1d291268",
      "bytes": 56515
    },
    {
      "path": "book/specs/CH-01-CONTINUO.json",
      "sha256": "4ca532a14c03132892958c2e14b4a3addc0fae51d3d12a0e0e4dd0f9abdd7a59",
      "bytes": 945
    },
    {
      "path": "book/specs/CH-02-CLASICA.json",
      "sha256": "4d10d3c232a7aabe75dccd4f9e0c22e8c5041fb5c36d0d59ba87f7cc23f67f02",
      "bytes": 951
    },
    {
      "path": "book/specs/CH-03-VECTORIAL.json",
      "sha256": "d1e5265c29028d2b9710596b9bcd98fa1b95451ce4094bc5e59c26d2dd188cf7",
      "bytes": 723
    },
    {
      "path": "book/specs/CH-04-CINEMATICA.json",
      "sha256": "de09a63af491f689585e652c1f3bd9be654689c66ce90a2df16fe5c73128ba68",
      "bytes": 699
    },
    {
      "path": "book/specs/CH-05-HIDROSTATICA.json",
      "sha256": "96c47e5fdcd6517261f899c36139ff7b8b6de57c2bf8611410ccd1cb3fcd1aa4",
      "bytes": 656
    },
    {
      "path": "book/specs/CH-06-CONSERVACION.json",
      "sha256": "ad73bbda68b69bcdc961e6882f4dadb97aa30244d0ab207933b0402d4d284f94",
      "bytes": 640
    },
    {
      "path": "book/specs/CH-07-ESFUERZOS.json",
      "sha256": "6dbf0ed7f135240c253e4a1dbb5c1437244e6257a7666ae8e68b4330be395ab9",
      "bytes": 599
    },
    {
      "path": "book/specs/CH-08-NAVIER-STOKES.json",
      "sha256": "44d184ca8f1a38a9c4d6de67f57df59e532c97d04a20e07e7b711049d90db5ea",
      "bytes": 891
    },
    {
      "path": "book/specs/CH-09-BERNOULLI.json",
      "sha256": "07ec9f772211460537e3ca1607281a23b5c7aa198d7ed1f5beec3c89973f8044",
      "bytes": 614
    },
    {
      "path": "book/specs/CH-10-SEMEJANZA.json",
      "sha256": "ee7b8efc508d2e8e0f6f0eb600bf061bf6eedafd579915b1d36482cf71ccb513",
      "bytes": 650
    },
    {
      "path": "book/specs/CH-11-APLICACIONES.json",
      "sha256": "b8c57c60be08ec495a6e7cb066f83e1aaa699fb3fd38dedf56104d21f409dd0f",
      "bytes": 689
    },
    {
      "path": "book/specs/CH-12-APROXIMACIONES.json",